{
  "id": "fu.atlas.high",
  "atlas": "high",
  "summary": "The High Fantasy Atlas for Fabula Ultima: a classic, epic JRPG toolkit where heroes rise from humble origins to challenge the gods. It adds ten archetypal locations (from the Starting Kingdom to the Infernal Fortress), guidance on conflicts, magic/rituals, technology and magitech, rare items and world-changing artifacts, four new Classes (Chanter, Commander, Dancer, Symbolist), 24 new Heroic Skills, and new optional subsystems: Custom Weapons, Quirks, and Zero Powers. It closes with five sample Villains for levels 10-60 (Eileen the Pirate Queen, the Flame Dragon, Cerine the Mournful Lady, Maximilian, and the metanarrative final boss Tragedia).",
  "rules_options": [
    {
      "key": "custom_weapons",
      "name": "Custom Weapons",
      "text": "An optional rule for making unusual signature weapons during character creation, with no profound gameplay implications. A custom weapon: belongs to one Category of your choice (arcane, bow, brawling, dagger, firearm, flail, heavy, spear, sword or thrown); is not martial (but may become martial via customizations); is two-handed (occupies both hand slots, cannot use Monkey Grip); is melee or ranged (your choice, regardless of Category); costs 300 zenit; its Accuracy Check relies on [DEX + INS] or [DEX + MIG]; and it deals [HR + 5] physical damage. It then receives three customizations (each chosen once). CUSTOMIZATIONS: Accurate (+2 to Accuracy formula); Defense Boost (+2 Defense, treated as having a shield for your Skills); Elemental (choose a damage type; damage becomes that type and deals +2); Magic Defense Boost [martial] (+2 Magic Defense); Powerful [martial] (+5 damage, or +7 if heavy; not for arcane/dagger/quick weapons); Quick [counts as two customizations, martial] (Attack action makes two attacks under two-weapon fighting rules); Transforming [+100 zenit cost] (a second form designed as a separate custom weapon that also has Transforming and costs no zenit; you may swap forms once per turn before/after an action; a transforming weapon has only one Quality shared by both forms). If a weapon's two forms differ in melee/ranged or Category, you only gain the benefits of one form at a time."
    },
    {
      "key": "quirks",
      "name": "High Fantasy Quirks",
      "text": "An advanced optional rule giving each Player Character a set of unique thematic and mechanical abilities. A PC may only ever have one Quirk; if Quirks are used it is strongly suggested every PC begins with one, and no two PCs share an identical Quirk. A character may lose and change their Quirk if the story supports it. On average a group with Quirks can tackle more challenging situations than normal for their level. Effects range from flight to spending Fabula Points for spellcasting. Use Quirks if you are comfortable setting aside power balance in favor of strong characterization; best for tight, collaborative groups. Many Quirks touch sensitive themes (gaslighting, xenophobia, social pressure, tragedy, being treated as \"not human\") — use lines and veils and pause the game if needed."
    },
    {
      "key": "zero_powers",
      "name": "Zero Powers",
      "text": "The most explosive optional rule in the book: each character unleashes an incredible effect when cornered. A character with a Zero Power gets a 6-section Zero Clock, charged during conflict scenes by: filling 1 section each time you spend 1 Fabula Point to invoke a Trait or Bond; filling 1 section each time you lose Hit Points (unless self-inflicted); and filling a variable number of sections when your chosen zero trigger activates. On your turn, if the Zero Clock is full, you may perform the Skill action to unleash your zero effect (once per turn); this erases all sections. Sections also fully erase at the end of each scene, and may only be filled/erased as described (or via Zero Chance). When creating a Zero Power, choose a trigger and an effect; a group must never include two PCs sharing a trigger, nor two sharing an effect. On average a group using Zero Powers defeats most foes easily. Variations: Awakened Power (choose the effect at creation but not the trigger; gain access only when you awaken it, once per campaign) and Combined Powers (Zero Clocks of 4 sections, each pair of PCs shares one zero effect unleashed only when both their Clocks are full; use with four or fewer PCs)."
    }
  ],
  "entries": [
    {
      "kind": "location",
      "key": "oniria",
      "name": "Oniria - The Starting Kingdom",
      "text": "The idyllic Starting Kingdom, a sheltered nest where life is serene (if boring) and a haven the party returns to between adventures. Oniria is the first location the protagonists visit, backdrop for the first relaxed sessions. It typically has an enigmatic leader who cares for the people, an ancient order of magical knights, and secret access to a forgotten place. Later it is either attacked by someone coveting its resources, or becomes the lair of an important Villain (a coup, catastrophe, or a revealed hidden base). Story hooks include Founder's Plaza (a marble plaza and the Night of Lights festival with its Contest of Heroes), the Nefti Ruins hidden behind Oniria's waterfall (holding the legendary Iris Sphere and the river nymph Sequana), and \"The Scam of the Century\" (the fraudulent merchant Emmet and his bodyguard Asher)."
    },
    {
      "kind": "location",
      "key": "artemis",
      "name": "Artemis - The Dark Forest",
      "text": "A dense, mysterious forest of tangled roads and untrodden paths that cloud the senses; something dark and terrible lurks at its heart, slowly corrupting it. Keywords: corruption, nature, secrets, unstable magic. Themes: destruction versus preservation, bewilderment, mysteries that should remain so. The group may cross it briefly early on but only face its lesser dangers; its deeper secrets lie beyond inexperienced heroes. An antagonist might use it as a lair. Story hooks: the Heart of the Forest and the corrupted oak home of the arboreal spirit Hathor and the corruption-spawning cocoon; the Verdant Sanctuary of the Lady of the Forest (an ancient minor Villain witch guarded by Guardian Roots); and Cursed Moon, the tale of Fenrir, a snow-white lycanthrope minor Villain and the Hunters' Guild."
    },
    {
      "kind": "location",
      "key": "mirage",
      "name": "Mirage - The Hidden Village",
      "text": "A village that appears like an illusion in the desert: buildings and palaces dug into solid red rock, crowned by carved stone towers, around a crystalline azure pond closely guarded by the people. Keywords: ancient magic, desert, mirage, reflection. Themes: the courage to face oneself in the mirror, the strength to challenge darkness and solitude. A hidden place appearing in an inhospitable area, reachable by a discovery roll or a Fabula Point. Its secrets entice Villains hungry for magical power. Story hooks: the Tower of Ten Thousand Mirrors and its test of courage (the Acceptance/Denial Clocks and the invisible sand spirit Xander); the Voice of Water spring inhabited by the gargantuan plant minor Villain Velaurog; and Lost in the Tunnels (Esther, the tomb raiders and their undead-raising leader Lord Chamberlain)."
    },
    {
      "kind": "location",
      "key": "yggdrasill",
      "name": "Yggdrasill - The World Tree",
      "text": "A single majestic tree whose branches stretch above the clouds and whose roots nourish the earth. Legend says all living things originated in Yggdrasill and will return to it at the world's last winter. Keywords: creation, divinity, humanity. Themes: protecting a fragile balance, tolerating all living creatures, understanding each other. An ideal place to conclude the first half of the campaign; as a point of connection between all creatures it is both threat and resource for antagonists, who may seek to destroy or conquer it. Story hooks: Eden, the city built within the bark, ruled by Consul Halcyon's council, with the magic Academy and the Light Bridges portals; Blue Despair, a magic illness of distrust cured by the Heart of Yggdrasill; and People on the Run, the Velimian refugees fleeing through an activated Light Bridge."
    },
    {
      "kind": "location",
      "key": "tethys",
      "name": "Tethys - The Great Ocean",
      "text": "A near-boundless, treacherous ocean rife with mysteries, frequent storms, and colossal sea beasts; mysterious music is sometimes heard from the depths on calm nights. Keywords: envy, specters, the past, transformation. Themes: loss of bearings, eternal wandering, old sins, forgotten tales. A great place to transition between the first and second halves of the story, or a boundary observed in wonder early on; the perfect setting for a chase between heroes and antagonists. Story hooks: the ghost ship Empress and its Skeleton crew and Skeletal Quartermaster; the Sunken City held in place by magic (the Song of Remembrance spell and the pirate captain Edwards of the Timoria); and the Goddesses' Envy, the tale of Scylla, a sea-fiend minor Villain with a ten-section Clock that swallows the PCs' ship."
    },
    {
      "kind": "location",
      "key": "endir",
      "name": "Endir - The Imperial Capital",